{
  "schema_version": 1,
  "escalation_id": "repository-state-recovery-01-none",
  "experiment_id": "repository-state-recovery-01",
  "created_at": "2026-08-08T03:30:00Z",
  "status": "resolved",
  "reason_code": "approval_required",
  "summary": "No escalation is required for the safe local fixture.",
  "evidence": ["All approval-gated and external actions are forbidden or unnecessary."],
  "requested_decision": "No decision required.",
  "allowed_resolutions": ["continue deterministic local lifecycle"],
  "tradeoffs": ["The fixture proves orchestration only and deliberately excludes model and external value measurement."],
  "recommended_choice": "Continue only through the bounded repository-local state machine.",
  "resolved_at": "2026-08-08T03:30:00Z",
  "resolution": "safe local fixture preregistered for shakedown"
}
